{
  "title": "A Novel Approach to JSON hjajdajda",
  "authors": [
    {
      "name": "Alice Doe",
      "affiliation": "University zxzof Typst",
      "email": ""
    }
  ],
  "abstract": "xz,czx,mccxzc",
  "content": [
    {
      "type": "section",
      "title": "Introduction",
      "content": [
        {
          "type": "paragraph",
          "text": "This is a demonstration of rendering *Typst syntax* directly from a structured JSON file [@Smith2023]. Typst is fast and supports natively powerful formatting."
        },
        {
          "type": "subsection",
          "title": "Mathematical Formulation",
          "content": [
            {
              "type": "paragraph",
              "text": "We define our core principle in the following block equation:"
            },
            {
              "type": "paragraph",
              "text": "$sum_(i=1)^n i = (n(n+1)) / 2$"
            }
          ]
        },
        {
          "type": "table",
          "columns": 3,
          "caption": "Experimental results comparing our method against the baseline. Values in $\"ms\"$.",
          "headers": [
            "Method",
            "Execution Time ($t$)",
            "Accuracy"
          ],
          "data": [
            [
              "Baseline",
              "120",
              "85.2%"
            ],
            [
              "*Proposed*",
              "*45*",
              "*98.1%*"
            ],
            [
              "Theoretical Limit",
              "$< 10$",
              "100%"
            ]
          ]
        },
        {
          "type": "image",
          "src": "diagram.png",
          "caption": "A structural overview of the system showing the data flow. Notice how *Typst markup* works inside captions too!"
        },
        {
          "type": "subsection",
          "title": "kkk",
          "content": [
            {
              "type": "paragraph",
              "text": "aaaaa"
            }
          ]
        },
        {
          "type": "subsection",
          "title": "Untitled Subsection",
          "content": []
        },
        {
          "type": "subsection",
          "title": "ZNCBZb",
          "content": [
            {
              "type": "paragraph",
              "text": "ZBcc c"
            }
          ]
        },
        {
          "type": "subsection",
          "title": "ZNCBZb",
          "content": [
            {
              "type": "paragraph",
              "text": "ZBcc c"
            }
          ]
        },
        {
          "type": "subsection",
          "title": "ZNCBZb",
          "content": [
            {
              "type": "paragraph",
              "text": "ZBcc c"
            }
          ]
        },
        {
          "type": "subsection",
          "title": "ZNCBZb",
          "content": [
            {
              "type": "paragraph",
              "text": "ZBcc c"
            }
          ]
        },
        {
          "type": "subsection",
          "title": "ZNCBZb",
          "content": [
            {
              "type": "paragraph",
              "text": "ZBcc c"
            }
          ]
        }
      ]
    },
    {
      "type": "section",
      "title": "man",
      "content": [
        {
          "type": "paragraph",
          "text": "man iii"
        }
      ]
    }
  ],
  "references": [
    {
      "id": "Doe2024",
      "citation": "A. Doe, _The Art of Typst_, 2024."
    },
    {
      "id": "Smith2023",
      "citation": "B. Smith, *Automating Document Generation*, Journal of Code, 2023."
    }
  ]
}